{
  "$schema": "https://json-schema.org/draft/2020-12/schema",
  "type": "object",
  "properties": {
    "title": {
      "default": "Sin Título",
      "type": "string"
    },
    "volanta": {
      "default": null,
      "anyOf": [
        {
          "type": "string"
        },
        {
          "type": "null"
        }
      ]
    },
    "draft": {
      "default": false,
      "type": "boolean"
    },
    "date": {
      "default": null,
      "anyOf": [
        {
          "type": "string"
        },
        {
          "type": "null"
        }
      ]
    },
    "category": {
      "default": "Ensayo",
      "anyOf": [
        {
          "type": "string"
        },
        {
          "type": "null"
        }
      ]
    },
    "themeColor": {
      "default": "british-green",
      "anyOf": [
        {
          "type": "string"
        },
        {
          "type": "null"
        }
      ]
    },
    "coverImage": {
      "default": null,
      "anyOf": [
        {
          "type": "string"
        },
        {
          "type": "null"
        }
      ]
    },
    "videoBg": {
      "default": null,
      "anyOf": [
        {
          "type": "string"
        },
        {
          "type": "null"
        }
      ]
    },
    "excerpt": {
      "default": "Sin descripción disponible.",
      "anyOf": [
        {
          "type": "string"
        },
        {
          "type": "null"
        }
      ]
    },
    "sitioGeohistorico": {
      "default": null,
      "anyOf": [
        {
          "type": "string"
        },
        {
          "type": "null"
        }
      ]
    },
    "publicarConImagen": {
      "default": true,
      "type": "boolean"
    },
    "generador": {
      "default": "",
      "type": "string"
    },
    "generadorTexto": {
      "default": null,
      "anyOf": [
        {
          "type": "string"
        },
        {
          "type": "null"
        }
      ]
    },
    "generadorImagen": {
      "default": null,
      "anyOf": [
        {
          "type": "string"
        },
        {
          "type": "null"
        }
      ]
    },
    "notasInvestigador": {
      "default": null,
      "anyOf": [
        {
          "type": "string"
        },
        {
          "type": "null"
        }
      ]
    },
    "spotifyLink": {
      "default": null,
      "anyOf": [
        {
          "type": "string"
        },
        {
          "type": "null"
        }
      ]
    },
    "youtubeLink": {
      "default": null,
      "anyOf": [
        {
          "type": "string"
        },
        {
          "type": "null"
        }
      ]
    },
    "$schema": {
      "type": "string"
    }
  }
}