{
  "title": "Aramu Muru: El Umbral Megalítico de Hayumarca",
  "date": "2026-08-03",
  "category": "Arqueosemiótica",
  "sitioGeohistorico": "Aramu Muru (Puno, Perú)",
  "publicarConImagen": true,
  "themeColor": "british-green",
  "draft": false,
  "excerpt": "Esculpida directamente sobre un frente arenisco rojo a orillas del Lago Titicaca, la misteriosa puerta de Aramu Muru desafía las fronteras entre geología, etnografía y arqueosemiótica.",
  "coverImage": "/src/assets/ensayos/tikal-1/coverImage.png"
}
