{
  "title": "Atila y el Papa ",
  "generador": "hecho artesanalmente (XB & AI)",
  "notasInvestigador": "Cinematic wide establishing shot, historic confrontation between Attila the Hun and Pope Leo I on the banks of a river, 1970s Panavision Anamorphic lens aesthetic, filmed on Arri Alexa 65, 65mm format. Dual-tone lighting: warm flickering orange glow from practical torches and campfires clashing with a cold ethereal pale blue moonlight. Kodak Vision3 500T film stock emulation, heavy cinematic grain, visceral textures of churned mud and rusted iron. Long dramatic shadows stretching across the landscape, horizontal blue anamorphic lens flares, subtle chromatic aberration at the frame edges. Attila in rugged fur and weathered leather armor, the Pope in ornate white and gold ecclesiastical robes. Hyper-realistic historical detail, breathtaking depth of field, solemn and immersive atmosphere, panoramic landscape orientation. --ar 16:9 --style raw --v 6.0",
  "generadorTexto": "**La Cruz y el Hacha: El Encuentro que Redefinió la Civilización en Occidente**\n\nEn el crepúsculo del Imperio Romano de Occidente, cuando la gloria de Roma se desvanecía en la oscuridad de la barbarie y el caos, un evento singular, casi mítico, alteró el curso de la historia. Fue el encuentro entre dos figuras que representaban mundos opuestos: Atila, el temido líder de los hunos, apodado \"el Azote de Dios\", y el Papa León I, conocido como \"el Grande\", la encarnación del poder espiritual en medio del colapso material. Este enfrentamiento, más allá de un simple acuerdo político, simboliza la lucha entre la fuerza bruta y la fe, la supervivencia de la civilización clásica y el nacimiento de una nueva era.\n\n**Atila: El Trueno del Este**\n\nAtila, al mando de las hordas hunas, encarnaba el terror puro para los romanos. Sus ejércitos, una marea imparable de guerreros curtidos en la batalla, habían asolado vastos territorios, dejando a su paso destrucción y muerte. Para la mente romana, Atila no era simplemente un enemigo; era un castigo divino, la manifestación del apocalipsis. Su reputación de crueldad y ferocidad le precedía, y su avance hacia Italia en el año 452 d.C. amenazaba con borrar de la faz de la tierra el último reducto de la civilización romana.\n\n**León I: El Pastor en la Tormenta**\n\nEn el otro extremo del espectro se encontraba el Papa León I. Mientras el Imperio se desmoronaba, la Iglesia Católica emergía como la única institución capaz de mantener cierto orden y cohesión social. León I, un hombre de profunda fe y aguda inteligencia, no era un líder militar, sino un pastor de almas. Su fuerza no residía en las espadas ni en los ejércitos, sino en la autoridad moral y espiritual que emanaba de su posición como Obispo de Roma.\n\n**El Encuentro en el Mincio**\n\nCuando Atila y sus hordas avanzaban hacia el sur, listos para saquear Roma, el emperador Valentiniano III, impotente ante la amenaza, envió una embajada para negociar la paz. La delegación estaba encabezada por el Papa León I, un gesto audaz que demostraba la desesperación del momento. El encuentro tuvo lugar cerca de Mantua, a orillas del río Mincio.\n\nLos detalles exactos de lo que se dijo en esa reunión siguen envueltos en el misterio. Los relatos históricos varían, algunos atribuyen el retroceso de Atila a una intervención divina, otros a la elocuencia de León I o a factores puramente prácticos como las enfermedades o la falta de suministros en el ejército huno. Sin embargo, lo que es innegable es el impacto de este encuentro en la imaginación colectiva y en el curso de la historia.\n\n**Simbolismo del Encuentro**\n\nEl enfrentamiento entre Atila y León I es rico en simbolismo. Representa la colisión de dos mundos:\n\n1. **La Fuerza Bruta vs. la Autoridad Espiritual:** Atila personificaba el poder militar crudo, la capacidad de imponer la voluntad a través de la violencia. León I, por el contrario, representaba una fuerza diferente, una fuerza que emana de la fe, la moral y la autoridad religiosa. El hecho de que Atila, el conquistador despiadado, cediera ante las palabras de un anciano desarmado, subraya la idea de que la verdadera fuerza no siempre reside en las armas.\n\n2. **La Civilización vs. la Barbarie:** Para los romanos, Atila era el epítome de la barbarie, la destrucción de la cultura y la civilización. León I, como líder de la Iglesia, encarnaba los restos de la tradición clásica, la ley, la orden y la espiritualidad. Su exitosa intervención puede interpretarse como un triunfo de la civilización sobre el caos, aunque sea temporalmente.\n\n3. **El Nacimiento de un Nuevo Orden:** El encuentro marcó un punto de inflexión en la relación entre la Iglesia y el Estado. Demostró que el poder papal no se limitaba al ámbito espiritual, sino que también tenía un papel político crucial. Este evento consolidó la posición de la Iglesia como una fuerza central en la Europa medieval, sentando las bases para el futuro papel del Papado en la política europea.\n\n**Reflexiones Finales**\n\nEl encuentro entre Atila y el Papa León I es un recordatorio de que la historia no está determinada únicamente por la fuerza militar. A menudo, son las ideas, la fe y la moral las que dan forma al curso de los acontecimientos. Aunque el Imperio Romano de Occidente finalmente colapsó, la Iglesia Católica sobrevivió, preservando elementos clave de la civilización clásica y sirviendo como un faro de estabilidad en una era de oscuridad. La figura de León I, de pie ante Atila, simboliza la capacidad del espíritu humano para resistir la violencia y el caos, y la importancia de la fe como una fuerza que puede alterar el curso de la historia.",
  "generadorImagen": "Cinematic wide establishing shot, historic confrontation between Attila the Hun and Pope Leo I on the banks of a river, 1970s Panavision Anamorphic lens aesthetic, filmed on Arri Alexa 65, 65mm format. Dual-tone lighting: warm flickering orange glow from practical torches and campfires clashing with a cold ethereal pale blue moonlight. Kodak Vision3 500T film stock emulation, heavy cinematic grain, visceral textures of churned mud and rusted iron. Long dramatic shadows stretching across the landscape, horizontal blue anamorphic lens flares, subtle chromatic aberration at the frame edges. Attila in rugged fur and weathered leather armor, the Pope in ornate white and gold ecclesiastical robes. Hyper-realistic historical detail, breathtaking depth of field, solemn and immersive atmosphere, panoramic landscape orientation. --ar 16:9 --style raw --v 6.0",
  "date": "2026-04-27",
  "category": "historia antigua",
  "themeColor": "rust-orange",
  "draft": false,
  "coverImage": "/src/assets/ensayos/atila-y-el-papa-copy/coverImage.jpeg",
  "excerpt": "\nEl encuentro entre Atila y el Papa León I es un recordatorio de que la historia no está determinada únicamente por la fuerza militar. A menudo, son las ideas, la fe y la moral las que dan forma al curso de los acontecimientos. Aunque el Imperio Romano de Occidente finalmente colapsó, la Iglesia Católica sobrevivió, preservando elementos clave de la civilización clásica y sirviendo como un faro de estabilidad en una era de oscuridad. La figura de León I, de pie ante Atila, simboliza la capacidad del espíritu humano para resistir la violencia y el caos, y la importancia de la fe como una fuerza que puede alterar el curso de la historia."
}
