{
  "title": "Simon, el Estilita",
  "date": "2026-08-03",
  "category": "Historia de las Ideas",
  "themeColor": "british-green",
  "draft": false,
  "coverImage": "/src/assets/ensayos/simon-el-estilita/coverImage.jpg",
  "excerpt": "\"Al elevarse sobre la planicie siria, Simeón no huyó del mundo, sino que lo transformó en un teatro de su propia negación. El pilar no fue un refugio, sino el pedestal de un dios que eligió pudrirse a la vista de todos para demostrar que el espíritu es, ante todo, un acto de violencia contra la carne.\"",
  "generadorTexto": "El desierto sirio del siglo V no era un vacío, sino un lienzo saturado de ansiedades ontológicas. En su centro, un hombre decidió que la superficie de la tierra estaba demasiado contaminada por el hedor de lo humano. Simeón el Estilita no se conformó con el exilio horizontal que ofrecía la arena; inauguró un exilio vertical. Su decisión de ascender a una columna y permanecer allí durante treinta y siete años no fue un mero acto de piedad excéntrica, sino una de las declaraciones filosóficas y performáticas más extremas de la Antigüedad tardía. En su afán por escapar del mundo, Simeón se convirtió, paradójicamente, en su centro de gravedad absoluto.\n\n## La Arquitectura de la Negación\n\nLa columna (*stylos*) sobre la que se erigió Simeón no debe entenderse bajo los parámetros de la arquitectura clásica, cuyo fin era sostener un techo o glorificar un templo. Su columna era una anti-arquitectura: una estructura diseñada no para albergar, sino para excluir. Al elevarse dieciocho metros sobre el suelo, Simeón cortó el cordón umbilical con la biopolítica de su tiempo. Renunció a la polis, a la comunidad y a la horizontalidad de las relaciones humanas, buscando en la verticalidad una línea de fuga hacia lo divino.\n\nEsta ascensión es una espacialización de la pureza. La tierra es el dominio del fango, la política, la economía y la muerte; el cielo es el territorio de lo inmutable. Simeón habitaba la fisura entre ambos, un no-lugar suspendido en el aire. Desde esa plataforma de apenas dos metros cuadrados, el estilitismo se nos revela como una forma de *hybris* invertida: una soberbia tan profunda que se disfraza de la más abyecta humillación.\n\n## El Cuerpo como Ruina y Monumento\n\nEl ascetismo del Estilita plantea un problema fascinante sobre la fenomenología del cuerpo. Lejos de ocultar su carne tras los muros de un monasterio, Simeón la exhibió. La suya fue una crucifixión en cámara lenta. Los biógrafos contemporáneos, como Teodoreto de Ciro, relatan con fascinación casi macabra las úlceras de sus piernas, la gangrena, los gusanos que caían de sus heridas y que él mismo volvía a colocar en su carne putrefacta susurrando: «come lo que Dios te ha dado». \n\nEl cuerpo de Simeón dejó de ser biología para convertirse en símbolo. Se transmutó en una ruina viva, un festín de decrepitud exhibido deliberadamente para demostrar la superioridad del intelecto y el espíritu sobre la materia. En un tono que resuena con el pensamiento de Bataille, el ascetismo de Simeón es un acto de exceso y derroche: destruye su cuerpo no por odio banal, sino porque la aniquilación de los límites corporales es el único método para acceder a una economía del infinito.\n\n### El Panóptico Inverso\n\nBuscando la soledad absoluta, Simeón engendró el mayor espectáculo de su época. El desierto se urbanizó a su alrededor. Peregrinos, beduinos, emperadores y prostitutas viajaban miles de kilómetros para observar a este atleta del sufrimiento. Foucault describió el panóptico como la torre central desde la cual un vigilante observa a la multitud encarcelada; Simeón creó un panóptico inverso. Él era el prisionero solitario en la torre central, observado por una multitud cautiva de su fascinación.\n\nLa mirada del otro, lejos de contaminarlo, validaba su martirio. Su aislamiento era, en el fondo, profundamente dependiente del público. No hay estilitismo sin espectadores. La columna era un escenario teatral, y su sufrimiento, una coreografía diseñada para quebrar la apatía espiritual de un Imperio Romano en decadencia.\n\n## El Vértigo de lo Vertical\n\nHoy, la figura de Simeón el Estilita nos produce una profunda incomodidad, no por su fanatismo, sino porque funciona como un espejo oscuro de nuestras propias psicopatologías modernas. Ya no erigimos columnas de piedra en el desierto, pero la pulsión persiste. Construimos pedestales digitales, buscando desesperadamente aislarnos de la masa mientras suplicamos ser observados por ella. \n\nSimeón nos recuerda que la verdadera huida nunca es horizontal. En un mundo saturado de ruido y horizontalidad, la historia del hombre en la columna permanece como un testamento sombrío: a veces, el único modo de soportar el peso aplastante de la humanidad es construir una plataforma, subirse a ella, y dejar que el viento borre gradualmente nuestro nombre, mientras el mundo entero nos mira desaparecer.",
  "generador": "Gemini-3.1-Pro"
}