{
  "title": "El Qapaq Ñan: una obra de ingenieria arcaica asombroso en las entrañas de Sudamerica",
  "notasInvestigador": "El Qapaq Ñan: una obra de ingenieria arcaica asombroso en las entrañas de Sudamerica",
  "generadorTexto": "La cordillera de los Andes no es una geografía, es un desafío ontológico. En este laberinto de piedra y abismo, donde el oxígeno se adelgaza y la verticalidad dicta la ley de la existencia, surgió el Qapaq Ñan no como una simple ruta de tránsito, sino como la urdimbre de un cosmos. No estamos ante una obra de ingeniería en el sentido moderno —una imposición de la voluntad humana sobre el entorno—, sino ante un diálogo tectónico donde la piedra se somete a la montaña para, paradójicamente, dominarla.\n\nMientras que la calzada romana buscaba la línea recta como símbolo de la racionalidad imperial que atraviesa la llanura, el camino incaico abraza el ángulo, la escalera y el zigzag. Su diseño es una síncopa rítmica que entiende que, en los Andes, la distancia más corta entre dos puntos no es la recta, sino la que respeta la voluntad del *Apu*. El Qapaq Ñan es, en esencia, la columna vertebral de un organismo político y espiritual: el Tawantinsuyu. Sin esta red de más de 30,000 kilómetros, el imperio habría sido un archipiélago de soledades; con ella, se convirtió en un sistema nervioso capaz de transmitir órdenes, tributos y dioses a la velocidad del chasqui.\n\nDesde una perspectiva filosófica, el camino encarna el concepto de *Pacha*: la unión indivisible de tiempo y espacio. Cada tramo de piedra, labrado con una precisión que desafía la erosión de los siglos, es un registro de la memoria colectiva. La ingeniería aquí es sagrada. Los drenajes que evitan que el camino se convierta en torrente, los muros de contención que desafían la gravedad y los puentes de fibras vegetales que suspenden el miedo sobre el vacío, son testimonios de una ciencia que no separaba la técnica de la mística. Para el quechua antiguo, transitar el Qapaq Ñan era un acto de reciprocidad (*Ayni*) con la tierra; el camino no solo se recorría, se habitaba.\n\nLa sofisticación de esta red radica en su capacidad para integrar pisos ecológicos radicalmente opuestos. Une el desierto costero, donde el sol calcina el silencio, con las cumbres gélidas donde la nieve es eterna, descendiendo luego hacia el vaho esmeralda de la selva. Esta conectividad no era meramente comercial; era una herramienta de control biopolítico. El camino permitía que el excedente agrícola de un valle mitigara la hambruna de otro, tejiendo una red de seguridad social que la modernidad, con toda su tecnología, a menudo no logra replicar. El camino era el Estado hecho piedra.\n\nHoy, el Qapaq Ñan sobrevive como un rastro espectral bajo el asfalto o como una herida abierta en la ladera de los cerros. Su contemplación nos obliga a cuestionar nuestra definición de progreso. En un siglo obsesionado con la velocidad y la desmaterialización de las fronteras, la solidez del camino incaico nos recuerda que la verdadera grandeza de una civilización se mide por su capacidad de armonizar la ambición humana con los límites del paisaje.\n\nEl Qapaq Ñan sigue siendo una lección de humildad arquitectónica. En sus peldaños desgastados reside la idea de que el hombre no conquista la tierra, sino que aprende a caminar sobre ella. Es el testamento de un pueblo que entendió que el movimiento es vida, pero que solo aquel movimiento que respeta el espíritu del lugar logra trascender la tiranía del tiempo. Al final, el camino no era para llegar a un destino; el camino era, en sí mismo, el destino de una cultura que aspiró a tocar el cielo con los pies firmemente anclados en la roca.",
  "generadorImagen": "",
  "date": "2026-04-28",
  "category": "arqueologia",
  "themeColor": "rust-orange",
  "draft": false,
  "coverImage": "/src/assets/ensayos/el-qapaq-nan-una-obra-de-ingenieria-arcaica-asombroso-en-las-entranas-de-sudamerica/coverImage.jpg",
  "videoBg": "El Qapaq Ñan: una obra de ingenieria arcaica asombroso en las entrañas de Sudamerica",
  "excerpt": "La sofisticación de esta red radica en su capacidad para integrar pisos ecológicos radicalmente opuestos. Une el desierto costero, donde el sol calcina el silencio, con las cumbres gélidas donde la nieve es eterna, descendiendo luego hacia el vaho esmeralda de la selva..."
}