{
  "title": "TEST 0NE HEMEROTECA",
  "themeColor": "british-green",
  "draft": false,
  "generador": "Gemini-1.5-Pro",
  "notasInvestigador": "",
  "spotifyLink": "https://open.spotify.com/episode/3G7WnU2l0a3a9W5P1U3Q2I",
  "youtubeLink": "https://www.youtube.com/watch?v=dQw4w9WgXcQ",
  "category": "test"
}